<?xml version="1.0" encoding="UTF-8"?>
<xs:schema xmlns:xs="http://www.w3.org/2001/XMLSchema" targetNamespace="http://namespaces.github.com/jochenw/qse/is/rules/1.0.0" xmlns:tns="http://namespaces.github.com/jochenw/qse/is/rules/1.0.0" elementFormDefault="qualified">
  <xs:element name="rules">
    <xs:complexType>
      <xs:sequence>
        <xs:element name="rule" type="tns:TRule" minOccurs="0" maxOccurs="unbounded">
        </xs:element>
      </xs:sequence>
    </xs:complexType>
  </xs:element>

  <xs:complexType name="TRule">
    <xs:choice minOccurs="0" maxOccurs="unbounded">
      <xs:element name="property">
        <xs:complexType>
          <xs:simpleContent>
            <xs:extension base="xs:string">
              <xs:attribute name="name" type="xs:string" use="required"/>
            </xs:extension>
          </xs:simpleContent>
        </xs:complexType>
      </xs:element>
      <xs:element name="listProperty">
        <xs:complexType>
          <xs:sequence>
            <xs:element name="value" minOccurs="0" maxOccurs="unbounded">
              <xs:complexType>
                <xs:simpleContent>
                  <xs:extension base="xs:string"/>
                </xs:simpleContent>
              </xs:complexType>
            </xs:element>
          </xs:sequence>
          <xs:attribute name="name" type="xs:string" use="required"/>
        </xs:complexType>
      </xs:element>
    </xs:choice>
    <xs:attribute name="enabled" type="xs:boolean" use="optional" default="true"/>
    <xs:attribute name="class" type="xs:string" use="required"/>
    <xs:attribute name="severity" type="tns:TSeverity" use="optional" default="WARN"/>
    <xs:attribute name="id" type="xs:string" use="optional"/>
  </xs:complexType>

  <xs:complexType name="TRuleProperty">
    <xs:choice>
      <xs:element name="property">
        <xs:complexType>
          <xs:simpleContent>
            <xs:extension base="xs:string">
              <xs:attribute name="name" type="xs:string" use="required"/>
            </xs:extension>
          </xs:simpleContent>
        </xs:complexType>
      </xs:element>
      <xs:element name="listProperty">
        <xs:complexType>
          <xs:sequence>
            <xs:element name="value" type="xs:string" minOccurs="0" maxOccurs="unbounded"/>
          </xs:sequence>
          <xs:attribute name="name" type="xs:string" use="required"/>
        </xs:complexType>
      </xs:element>
    </xs:choice>
  </xs:complexType>

  <xs:simpleType name="TSeverity">
    <xs:restriction base="xs:string">
      <xs:enumeration value="INFO"/>
      <xs:enumeration value="WARN"/>
      <xs:enumeration value="ERROR"/>
    </xs:restriction>
  </xs:simpleType>
</xs:schema>
